{
  "schema_version": "0.2-draft",
  "record_status": "draft_requires_human_review",
  "collected_at": "2026-10-10",
  "scope_note": "전처리 전 원본 수집 데이터다. 작품 메타데이터와 해설 문서를 분리했으며, 전처리 시 artists.jsonl, artworks.jsonl, documents.jsonl로 변환할 수 있다.",
  "default_content_rights": {
    "applies_to": ["artist.summary", "artworks[].description"],
    "content_author": "SKN35-3rd-1Team 데이터팀",
    "copyright_notice": "© 2026 SKN35-3rd-1Team 데이터팀. 공식 기관의 사실 정보에 근거해 새로 작성한 한국어 요약이다.",
    "license": "CC BY 4.0"
  },
  "artist": {
    "slug": "paul-gauguin",
    "name": "폴 고갱",
    "name_en": "Paul Gauguin",
    "birth_year": 1848,
    "death_year": 1903,
    "nationality": "프랑스",
    "movement_slug": "post-impressionism",
    "summary": "인상주의에서 출발해 넓고 평평한 색면, 강한 윤곽, 상징적 주제로 독자적인 양식을 발전시킨 후기인상주의 화가다. 브르타뉴와 프랑스령 폴리네시아에서 작업했으며, 그의 남태평양 이미지는 미술사적 영향과 함께 식민주의적 시선이라는 비판적 맥락에서 다뤄져야 한다.",
    "portrait_url": null,
    "portrait_source_url": "https://www.nga.gov/artists/1330-paul-gauguin",
    "portrait_license": "미정: 사용 전 해당 이미지의 개별 권리표시 확인 필요"
  },
  "artworks": [
    {
      "slug": "ia-orana-maria",
      "artist_slug": "paul-gauguin",
      "movement_slug": "post-impressionism",
      "title": "이아 오라나 마리아",
      "title_en": "Ia Orana Maria (Hail Mary)",
      "year_label": "1891",
      "year_start": 1891,
      "medium": "캔버스에 유채",
      "dimensions": "113.7 × 87.6 cm",
      "collection": "The Metropolitan Museum of Art, New York",
      "object_number": "51.112.2",
      "description": "기독교의 성모자와 경배 장면을 타히티 배경과 인물로 재구성한 고갱의 초기 타히티 대표작이다.",
      "image_url": null,
      "image_api_url": "https://collectionapi.metmuseum.org/public/collection/v1/objects/438821",
      "image_source_url": "https://www.metmuseum.org/art/collection/search/438821",
      "image_license": "CC0 1.0 (The Met Open Access 표시 이미지)",
      "image_license_url": "https://creativecommons.org/publicdomain/zero/1.0/",
      "is_featured": true
    },
    {
      "slug": "tahitian-landscape",
      "artist_slug": "paul-gauguin",
      "movement_slug": "post-impressionism",
      "title": "타히티 풍경",
      "title_en": "Tahitian Landscape",
      "year_label": "1892",
      "year_start": 1892,
      "medium": "캔버스에 유채",
      "dimensions": "64.5 × 47.3 cm",
      "collection": "The Metropolitan Museum of Art, New York",
      "object_number": "39.182",
      "description": "첫 타히티 체류기에 그린 풍경으로, 열대 식생 속 오두막과 인물, 말을 넓은 색면으로 구성했다.",
      "image_url": null,
      "image_api_url": "https://collectionapi.metmuseum.org/public/collection/v1/objects/436451",
      "image_source_url": "https://www.metmuseum.org/art/collection/search/436451",
      "image_license": "CC0 1.0 (The Met Open Access 표시 이미지)",
      "image_license_url": "https://creativecommons.org/publicdomain/zero/1.0/",
      "is_featured": false
    },
    {
      "slug": "the-siesta",
      "artist_slug": "paul-gauguin",
      "movement_slug": "post-impressionism",
      "title": "낮잠",
      "title_en": "The Siesta",
      "year_label": "c. 1892–1894",
      "year_start": 1892,
      "medium": "캔버스에 유채",
      "dimensions": "88.9 × 116.2 cm",
      "collection": "The Metropolitan Museum of Art, New York",
      "object_number": "1993.400.3",
      "description": "그늘진 베란다에 모인 타히티 여성들의 일상적 휴식을 넓은 색면과 분명한 윤곽으로 표현했다.",
      "image_url": null,
      "image_api_url": "https://collectionapi.metmuseum.org/public/collection/v1/objects/436449",
      "image_source_url": "https://www.metmuseum.org/art/collection/search/436449",
      "image_license": "CC0 1.0 (The Met Open Access 표시 이미지)",
      "image_license_url": "https://creativecommons.org/publicdomain/zero/1.0/",
      "is_featured": true
    },
    {
      "slug": "three-tahitian-women",
      "artist_slug": "paul-gauguin",
      "movement_slug": "post-impressionism",
      "title": "세 명의 타히티 여성",
      "title_en": "Three Tahitian Women",
      "year_label": "1896",
      "year_start": 1896,
      "medium": "나무판에 유채",
      "dimensions": "24.4 × 43.2 cm",
      "collection": "The Metropolitan Museum of Art, New York",
      "object_number": "1997.60.3",
      "description": "작은 가로형 나무판에 세 인물을 단순화된 형태와 응축된 색면으로 배열한 작품이다.",
      "image_url": null,
      "image_api_url": "https://collectionapi.metmuseum.org/public/collection/v1/objects/438000",
      "image_source_url": "https://www.metmuseum.org/art/collection/search/438000",
      "image_license": "CC0 1.0 (The Met Open Access 표시 이미지)",
      "image_license_url": "https://creativecommons.org/publicdomain/zero/1.0/",
      "is_featured": false
    },
    {
      "slug": "still-life-with-teapot-and-fruit",
      "artist_slug": "paul-gauguin",
      "movement_slug": "post-impressionism",
      "title": "찻주전자와 과일이 있는 정물",
      "title_en": "Still Life with Teapot and Fruit",
      "year_label": "1896",
      "year_start": 1896,
      "medium": "캔버스에 유채",
      "dimensions": "47.6 × 66 cm",
      "collection": "The Metropolitan Museum of Art, New York",
      "object_number": "1997.391.2",
      "description": "세잔의 정물 구성을 참조하면서 사과 대신 망고, 프랑스식 배경 대신 타히티풍 천과 인물을 결합했다.",
      "image_url": null,
      "image_api_url": "https://collectionapi.metmuseum.org/public/collection/v1/objects/437999",
      "image_source_url": "https://www.metmuseum.org/art/collection/search/437999",
      "image_license": "CC0 1.0 (The Met Open Access 표시 이미지)",
      "image_license_url": "https://creativecommons.org/publicdomain/zero/1.0/",
      "is_featured": false
    },
    {
      "slug": "two-tahitian-women",
      "artist_slug": "paul-gauguin",
      "movement_slug": "post-impressionism",
      "title": "두 명의 타히티 여성",
      "title_en": "Two Tahitian Women",
      "year_label": "1899",
      "year_start": 1899,
      "medium": "캔버스에 유채",
      "dimensions": "94 × 72.4 cm",
      "collection": "The Metropolitan Museum of Art, New York",
      "object_number": "49.58.1",
      "description": "꽃과 과일을 든 두 여성을 가까이 배치한 작품으로, 고갱이 구성한 이상화된 타히티 이미지와 남성적·식민주의적 시선을 함께 검토할 필요가 있다.",
      "image_url": null,
      "image_api_url": "https://collectionapi.metmuseum.org/public/collection/v1/objects/436446",
      "image_source_url": "https://www.metmuseum.org/art/collection/search/436446",
      "image_license": "CC0 1.0 (The Met Open Access 표시 이미지)",
      "image_license_url": "https://creativecommons.org/publicdomain/zero/1.0/",
      "is_featured": true
    }
  ],
  "documents": [
    {
      "document_key": "bio-paul-gauguin",
      "doc_type": "artist_bio",
      "title": "폴 고갱의 생애와 작품 세계",
      "year": "1848–1903",
      "artist_slugs": ["paul-gauguin"],
      "artwork_slug": null,
      "content": "폴 고갱은 1848년 파리에서 태어났고 어린 시절 일부를 페루에서 보냈다. 상선과 해군에서 일한 뒤 파리의 증권거래 관련 직업을 가졌으며, 1870년대에는 미술품을 수집하고 취미로 그림을 그리기 시작했다. 카미유 피사로 등 인상주의 화가들과 교류하고 인상주의 전시에 참여했지만, 점차 자연을 눈앞의 빛으로 묘사하는 방식에서 벗어나 넓은 색면, 굵은 윤곽, 단순화된 형태와 상징적 주제를 추구했다. 브르타뉴 퐁타방에서 작업하며 종합주의로 불리는 양식을 발전시켰고, 1888년에는 아를에서 빈센트 반 고흐와 약 두 달 동안 함께 생활했다. 1891년 프랑스령 타히티로 떠났다가 프랑스로 돌아왔고, 1895년 다시 남태평양으로 건너가 말년에는 마르키즈제도의 히바오아에서 살다가 1903년 사망했다. 고갱의 색채와 평면적 구성은 나비파와 야수주의 등 20세기 미술에 영향을 주었다. 그러나 타히티를 식민지 현실과 분리된 ‘원시적 낙원’처럼 구성하고 원주민 여성을 대상화한 시선은 오늘날 반드시 비판적으로 검토된다. 따라서 그의 남태평양 작품은 형식적 혁신뿐 아니라 프랑스 식민주의, 작가가 만든 신화, 실제 현지인의 삶이 어떻게 어긋나는지도 함께 살펴야 한다.",
      "source_url": "https://www.nga.gov/sites/default/files/migrate_images/content/dam/ngaweb/education/learning-resources/teaching-packets/pdfs/picturing_france.pdf",
      "source_name": "National Gallery of Art, Picturing France 1830–1900 (p.118)",
      "license": "CC BY 4.0 (이 데이터셋의 새 한국어 해설문)",
      "content_author": "SKN35-3rd-1Team 데이터팀",
      "copyright_notice": "© 2026 SKN35-3rd-1Team 데이터팀. 공식 기관의 사실 정보에 근거해 새로 작성한 한국어 요약이며 원문 해설을 번역·복제하지 않았다. CC BY 4.0에 따라 출처와 작성자를 표시하면 재사용할 수 있다.",
      "source_rights_note": "NGA 자료는 사실 확인용 참고자료다. PDF 원문과 이미지는 복제하지 않았으며 개별 이용 조건은 NGA 정책을 확인해야 한다.",
      "review_status": "팀 검수 필요"
    },
    {
      "document_key": "commentary-ia-orana-maria",
      "doc_type": "artwork_commentary",
      "title": "폴 고갱 《이아 오라나 마리아》 해설",
      "year": "1891",
      "artwork_slug": "ia-orana-maria",
      "content": "[기본 정보] 고갱이 첫 타히티 체류기에 제작한 대형 회화다. 제목 ‘이아 오라나 마리아’는 성모에게 건네는 인사 또는 성모송과 관련된다. [화면 관찰] 화면 오른쪽에는 붉은 옷을 입은 여성이 아이를 어깨에 태우고 서 있으며 두 인물의 머리 뒤에는 노란 후광이 있다. 가운데의 두 여성은 꽃무늬 파레우를 두르고 두 손을 모아 경배하는 자세를 취한다. 왼쪽 나무 사이에는 노란 날개를 가진 천사가 부분적으로 보인다. 전경에는 과일이 놓여 있고, 뒤에는 짙은 산과 열대 식물이 층을 이룬다. [세부 요소와 도상] 후광은 성모 마리아와 아기 예수를, 모은 손은 경배를, 날개는 천사를 알아보게 하는 기독교 도상이다. 그러나 인물의 외모와 복식, 식물과 과일은 타히티 배경으로 바뀌었다. [구성과 기법] 깊은 원근보다 붉은색·노란색·초록색의 큰 면과 굵은 윤곽이 강조되어 장면이 벽화나 장식 패널처럼 보인다. [근거 있는 해석] 고갱은 서양 기독교 이미지를 타히티 환경과 결합해 새로운 종교 장면을 구성했다. 이는 실제 타히티 의례의 기록이 아니라 유럽 출신 화가의 상상과 선택이 개입된 재구성이다. [질문 대응 한계] 과일 하나의 위치나 두 여성의 개인적 정체처럼 공식 자료가 밝히지 않는 세부 의도는 단정하지 말고, 도상과 구성에서 확인되는 기능까지만 설명해야 한다.",
      "source_url": "https://www.metmuseum.org/art/collection/search/438821",
      "source_name": "The Metropolitan Museum of Art",
      "license": "CC BY 4.0 (이 데이터셋의 새 한국어 해설문)",
      "content_author": "SKN35-3rd-1Team 데이터팀",
      "copyright_notice": "© 2026 SKN35-3rd-1Team 데이터팀. The Met의 CC0 소장품 데이터와 작품 정보를 바탕으로 새로 작성한 해설이다. 원문 설명문은 복제하지 않았다. CC BY 4.0.",
      "source_rights_note": "소장품 기본 데이터와 OA 표시 이미지는 CC0이며, 미술관 웹페이지의 설명문 자체는 별도 저작권 대상이므로 복제하지 않았다.",
      "review_status": "팀 검수 필요"
    },
    {
      "document_key": "commentary-tahitian-landscape",
      "doc_type": "artwork_commentary",
      "title": "폴 고갱 《타히티 풍경》 해설",
      "year": "1892",
      "artwork_slug": "tahitian-landscape",